{
  "schema_version": 1,
  "project": "dyson-one",
  "charter": "observe-and-rank",
  "generated_at": "2026-10-29T18:11:28Z",
  "count": 120,
  "hash": "2953f447701e63c6",
  "budgets": {
    "http_timeout_s": 45,
    "nhats_limit": 60,
    "cad_limit": 60,
    "sbdb_lookups": 12,
    "sbdb_pause_s": 0.25,
    "critic_tokens_max": 0,
    "top_n_brief": 25,
    "attention_n": 8
  },
  "attention": {
    "unknown_low_dv": [
      "2000 SG344",
      "2006 BZ147",
      "2009 HC",
      "2007 CS5",
      "2010 JK1",
      "2009 UY19",
      "2009 BW2",
      "2007 YF"
    ],
    "missing_approach": [
      "1997 YM9",
      "2000 AE205",
      "2000 AG6",
      "2000 SG344",
      "2000 UK11",
      "2001 AV43",
      "2001 CQ36",
      "2001 VE2"
    ],
    "high_water": [
      "99942",
      "2001 KF54",
      "2016 NV",
      "524522",
      "474158",
      "341843",
      "2020 OP3",
      "2009 UY19"
    ]
  },
  "objects": [
    {
      "designation": "99942",
      "name": "99942 Apophis (2004 MN4)",
      "spec": null,
      "spec_family": "unknown",
      "h_mag": 19.1,
      "diameter_km": 0.264,
      "dv_kms": 6.049,
      "next_approach": null,
      "approach_au": null,
      "water_score": 0.005178,
      "pgm_score": 0.004142,
      "confidence": 0.45,
      "earth_spot_usd_vanity": 2890225.03,
      "notes": [
        "spectral class unknown; scores capped in meaning",
        "earth_spot_usd_vanity is a toy mass*price, not NPV"
      ]
    },
    {
      "designation": "2001 KF54",
      "name": null,
      "spec": null,
      "spec_family": "unknown",
      "h_mag": 19.79,
      "diameter_km": 0.3913,
      "dv_kms": 12.0,
      "next_approach": "2026-Nov-06 03:38",
      "approach_au": 0.0484212697109624,
      "water_score": 0.004895,
      "pgm_score": 0.003916,
      "confidence": 0.35,
      "earth_spot_usd_vanity": 9408118.23,
      "notes": [
        "diameter estimated from H with albedo 0.14",
        "delta-v missing; penalty dv=12 km/s applied",
        "spectral class unknown; scores capped in meaning",
        "earth_spot_usd_vanity is a toy mass*price, not NPV"
      ]
    },
    {
      "designation": "2016 NV",
      "name": null,
      "spec": null,
      "spec_family": "unknown",
      "h_mag": 19.86,
      "diameter_km": 0.3788,
      "dv_kms": 12.0,
      "next_approach": "2026-Dec-08 18:43",
      "approach_au": 0.0366182614622184,
      "water_score": 0.004664,
      "pgm_score": 0.003731,
      "confidence": 0.35,
      "earth_spot_usd_vanity": 8540882.88,
      "notes": [
        "diameter estimated from H with albedo 0.14",
        "delta-v missing; penalty dv=12 km/s applied",
        "spectral class unknown; scores capped in meaning",
        "earth_spot_usd_vanity is a toy mass*price, not NPV"
      ]
    },
    {
      "designation": "524522",
      "name": null,
      "spec": null,
      "spec_family": "unknown",
      "h_mag": 20.54,
      "diameter_km": 0.277,
      "dv_kms": 12.0,
      "next_approach": "2026-Nov-02 19:10",
      "approach_au": 0.0402310329597059,
      "water_score": 0.002916,
      "pgm_score": 0.002332,
      "confidence": 0.35,
      "earth_spot_usd_vanity": 3338126.31,
      "notes": [
        "diameter estimated from H with albedo 0.14",
        "delta-v missing; penalty dv=12 km/s applied",
        "spectral class unknown; scores capped in meaning",
        "earth_spot_usd_vanity is a toy mass*price, not NPV"
      ]
    },
    {
      "designation": "474158",
      "name": null,
      "spec": null,
      "spec_family": "unknown",
      "h_mag": 20.71,
      "diameter_km": 0.2561,
      "dv_kms": 12.0,
      "next_approach": "2027-Mar-04 05:02",
      "approach_au": 0.0424478641013942,
      "water_score": 0.002593,
      "pgm_score": 0.002074,
      "confidence": 0.35,
      "earth_spot_usd_vanity": 2639385.13,
      "notes": [
        "diameter estimated from H with albedo 0.14",
        "delta-v missing; penalty dv=12 km/s applied",
        "spectral class unknown; scores capped in meaning",
        "earth_spot_usd_vanity is a toy mass*price, not NPV"
      ]
    },
    {
      "designation": "341843",
      "name": "341843 (2008 EV5)",
      "spec": null,
      "spec_family": "unknown",
      "h_mag": 20.1,
      "diameter_km": 0.17,
      "dv_kms": 6.291,
      "next_approach": null,
      "approach_au": null,
      "water_score": 0.00258,
      "pgm_score": 0.002064,
      "confidence": 0.45,
      "earth_spot_usd_vanity": 771732.24,
      "notes": [
        "spectral class unknown; scores capped in meaning",
        "earth_spot_usd_vanity is a toy mass*price, not NPV"
      ]
    },
    {
      "designation": "2020 OP3",
      "name": null,
      "spec": null,
      "spec_family": "unknown",
      "h_mag": 20.95,
      "diameter_km": 0.2293,
      "dv_kms": 12.0,
      "next_approach": "2027-Jan-28 23:33",
      "approach_au": 0.0195088971020463,
      "water_score": 0.002196,
      "pgm_score": 0.001757,
      "confidence": 0.35,
      "earth_spot_usd_vanity": 1894535.58,
      "notes": [
        "diameter estimated from H with albedo 0.14",
        "delta-v missing; penalty dv=12 km/s applied",
        "spectral class unknown; scores capped in meaning",
        "earth_spot_usd_vanity is a toy mass*price, not NPV"
      ]
    },
    {
      "designation": "2009 UY19",
      "name": "(2009 UY19)",
      "spec": null,
      "spec_family": "unknown",
      "h_mag": 23.4,
      "diameter_km": 0.105,
      "dv_kms": 5.079,
      "next_approach": null,
      "approach_au": null,
      "water_score": 0.001525,
      "pgm_score": 0.00122,
      "confidence": 0.45,
      "earth_spot_usd_vanity": 181839.31,
      "notes": [
        "spectral class unknown; scores capped in meaning",
        "earth_spot_usd_vanity is a toy mass*price, not NPV"
      ]
    },
    {
      "designation": "535844",
      "name": null,
      "spec": null,
      "spec_family": "unknown",
      "h_mag": 21.89,
      "diameter_km": 0.1488,
      "dv_kms": 12.0,
      "next_approach": "2027-Mar-04 20:59",
      "approach_au": 0.0235812256428188,
      "water_score": 0.001147,
      "pgm_score": 0.000918,
      "confidence": 0.35,
      "earth_spot_usd_vanity": 517014.55,
      "notes": [
        "diameter estimated from H with albedo 0.14",
        "delta-v missing; penalty dv=12 km/s applied",
        "spectral class unknown; scores capped in meaning",
        "earth_spot_usd_vanity is a toy mass*price, not NPV"
      ]
    },
    {
      "designation": "2024 RR14",
      "name": null,
      "spec": null,
      "spec_family": "unknown",
      "h_mag": 22.02,
      "diameter_km": 0.1401,
      "dv_kms": 12.0,
      "next_approach": "2027-Jan-13 19:24",
      "approach_au": 0.0215582053114083,
      "water_score": 0.001049,
      "pgm_score": 0.000839,
      "confidence": 0.35,
      "earth_spot_usd_vanity": 432018.92,
      "notes": [
        "diameter estimated from H with albedo 0.14",
        "delta-v missing; penalty dv=12 km/s applied",
        "spectral class unknown; scores capped in meaning",
        "earth_spot_usd_vanity is a toy mass*price, not NPV"
      ]
    },
    {
      "designation": "2015 DG200",
      "name": null,
      "spec": null,
      "spec_family": "unknown",
      "h_mag": 22.29,
      "diameter_km": 0.1237,
      "dv_kms": 12.0,
      "next_approach": "2027-Jan-22 12:01",
      "approach_au": 0.00952786213700134,
      "water_score": 0.00087,
      "pgm_score": 0.000696,
      "confidence": 0.35,
      "earth_spot_usd_vanity": 297510.82,
      "notes": [
        "diameter estimated from H with albedo 0.14",
        "delta-v missing; penalty dv=12 km/s applied",
        "spectral class unknown; scores capped in meaning",
        "earth_spot_usd_vanity is a toy mass*price, not NPV"
      ]
    },
    {
      "designation": "2017 WJ2",
      "name": null,
      "spec": null,
      "spec_family": "unknown",
      "h_mag": 22.4,
      "diameter_km": 0.1176,
      "dv_kms": 12.0,
      "next_approach": "2026-Nov-05 04:22",
      "approach_au": 0.0399993405263048,
      "water_score": 0.000807,
      "pgm_score": 0.000645,
      "confidence": 0.35,
      "earth_spot_usd_vanity": 255565.82,
      "notes": [
        "diameter estimated from H with albedo 0.14",
        "delta-v missing; penalty dv=12 km/s applied",
        "spectral class unknown; scores capped in meaning",
        "earth_spot_usd_vanity is a toy mass*price, not NPV"
      ]
    },
    {
      "designation": "363305",
      "name": "363305 (2002 NV16)",
      "spec": null,
      "spec_family": "unknown",
      "h_mag": 21.4,
      "diameter_km": 0.09,
      "dv_kms": 7.97,
      "next_approach": null,
      "approach_au": null,
      "water_score": 0.000797,
      "pgm_score": 0.000638,
      "confidence": 0.45,
      "earth_spot_usd_vanity": 114511.05,
      "notes": [
        "spectral class unknown; scores capped in meaning",
        "earth_spot_usd_vanity is a toy mass*price, not NPV"
      ]
    },
    {
      "designation": "2020 XC3",
      "name": null,
      "spec": null,
      "spec_family": "unknown",
      "h_mag": 22.55,
      "diameter_km": 0.1098,
      "dv_kms": 12.0,
      "next_approach": "2026-Dec-08 00:44",
      "approach_au": 0.0371477058612161,
      "water_score": 0.000727,
      "pgm_score": 0.000582,
      "confidence": 0.35,
      "earth_spot_usd_vanity": 207731.7,
      "notes": [
        "diameter estimated from H with albedo 0.14",
        "delta-v missing; penalty dv=12 km/s applied",
        "spectral class unknown; scores capped in meaning",
        "earth_spot_usd_vanity is a toy mass*price, not NPV"
      ]
    },
    {
      "designation": "433303",
      "name": "433303 (2013 NX)",
      "spec": null,
      "spec_family": "unknown",
      "h_mag": 22.1,
      "diameter_km": 0.066,
      "dv_kms": 6.681,
      "next_approach": null,
      "approach_au": null,
      "water_score": 0.00059,
      "pgm_score": 0.000472,
      "confidence": 0.45,